{
  "$schema": "https://json-schema.org/draft/2020-12/schema",
  "$id": "https://collabcentral.example/schedule-viewer/schedule.schema.json",
  "title": "Schedule document",
  "type": "object",
  "additionalProperties": false,
  "required": ["schemaVersion", "title", "milestoneGroups", "milestones", "categories"],
  "properties": {
    "schemaVersion": {
      "type": "integer",
      "const": 8,
      "description": "8: タスクの status を、ステータス一覧の id を書く文字列にする。7 以前は読み込み時に 8 へ移行し、status の値は変えない。7 はタスクに任意の tags（文字列配列）を足せる。マイルストンは milestoneGroups の groupId で帯の行に分ける。カテゴリとグループは id を持つ。タスクとマイルストンの confidence は tentative か committed。担当は assigneeId（未割当は null）。終了日はその日を含む。"
    },
    "title": {
      "type": "string",
      "minLength": 1
    },
    "milestoneGroups": {
      "type": "array",
      "items": { "$ref": "#/$defs/milestoneGroup" }
    },
    "milestones": {
      "type": "array",
      "items": { "$ref": "#/$defs/milestone" }
    },
    "categories": {
      "type": "array",
      "minItems": 1,
      "items": { "$ref": "#/$defs/category" }
    }
  },
  "$defs": {
    "scheduleId": {
      "type": "string",
      "format": "uuid"
    },
    "isoDate": {
      "type": "string",
      "format": "date"
    },
    "taskStatus": {
      "type": "string",
      "minLength": 1,
      "description": "ステータス一覧の項目の id。既定の一覧は not-started、in-progress、done。"
    },
    "milestoneGroup": {
      "type": "object",
      "additionalProperties": false,
      "required": ["id", "name"],
      "properties": {
        "id": { "$ref": "#/$defs/scheduleId" },
        "name": { "type": "string", "minLength": 1 }
      }
    },
    "milestone": {
      "type": "object",
      "additionalProperties": false,
      "required": ["id", "name", "date", "confidence", "groupId"],
      "properties": {
        "id": { "$ref": "#/$defs/scheduleId" },
        "name": { "type": "string", "minLength": 1 },
        "date": { "$ref": "#/$defs/isoDate" },
        "confidence": {
          "type": "string",
          "enum": ["tentative", "committed"],
          "description": "日付を合意したかどうか。tentative は未確定、committed は確定。タスクの確度とは独立。"
        },
        "groupId": { "$ref": "#/$defs/scheduleId" }
      }
    },
    "task": {
      "type": "object",
      "additionalProperties": false,
      "required": [
        "id",
        "name",
        "start",
        "end",
        "assigneeId",
        "status",
        "progress",
        "confidence",
        "predecessors",
        "milestoneId"
      ],
      "properties": {
        "id": { "$ref": "#/$defs/scheduleId" },
        "name": { "type": "string", "minLength": 1 },
        "start": { "$ref": "#/$defs/isoDate" },
        "end": {
          "$ref": "#/$defs/isoDate",
          "description": "終了日（この日を含む）。開始日以降。"
        },
        "assigneeId": {
          "oneOf": [
            { "type": "string", "minLength": 1 },
            { "type": "null" }
          ]
        },
        "status": { "$ref": "#/$defs/taskStatus" },
        "progress": { "type": "integer", "minimum": 0, "maximum": 100 },
        "confidence": {
          "type": "string",
          "enum": ["tentative", "committed"],
          "description": "日付を合意したかどうか。着手や進捗とは独立。tentative は未確定、committed は確定。"
        },
        "predecessors": {
          "type": "array",
          "items": { "$ref": "#/$defs/scheduleId" },
          "uniqueItems": true
        },
        "milestoneId": {
          "oneOf": [
            { "$ref": "#/$defs/scheduleId" },
            { "type": "null" }
          ]
        },
        "tags": {
          "type": "array",
          "items": { "type": "string", "minLength": 1 },
          "description": "説明用の任意タグ。画面では絞り込みに使う。"
        },
        "note": {
          "type": "string",
          "minLength": 1,
          "description": "タスクの補足説明（任意）。画面ではノートとして表示する。"
        }
      }
    },
    "taskGroup": {
      "type": "object",
      "additionalProperties": false,
      "required": ["id", "name", "tasks"],
      "properties": {
        "id": { "$ref": "#/$defs/scheduleId" },
        "name": { "type": "string", "minLength": 1 },
        "tasks": {
          "type": "array",
          "items": { "$ref": "#/$defs/task" }
        }
      }
    },
    "category": {
      "type": "object",
      "additionalProperties": false,
      "required": ["id", "name", "groups"],
      "properties": {
        "id": { "$ref": "#/$defs/scheduleId" },
        "name": { "type": "string", "minLength": 1 },
        "groups": {
          "type": "array",
          "minItems": 1,
          "items": { "$ref": "#/$defs/taskGroup" }
        }
      }
    }
  }
}
